{
  "schema_version": "2.1",
  "system_name": "PHYSMASTER 自主 AI 物理学家",
  "source_summary": "一篇论文 gap 笔记，描述 PHYSMASTER 这一基于 LLM 的 agent：把理论推理与数值计算结合，配 LANDAU 分层学术数据宇宙，用 MCTS + 分层 agent 协作 + 自适应探索处理超长周期科研任务，并把成熟度分为加速/自动化/自主发现三级。",
  "original_problem": "如何让 AI agent 端到端地跑完一个被给定或被选定的物理问题，并由一个 LLM critic 判断结果好不好、新不新，从而从科研辅助工具跨越为自主 AI 物理学家。",
  "actors": [
    {
      "id": "A01",
      "name": "PHYSMASTER 主 agent",
      "role": "接收物理问题，调度理论推理与数值计算，驱动 MCTS 搜索与分层协作，端到端产出方法与结果。",
      "incentives": [
        "完成被给定的任务",
        "压缩资深博士级工程环节的耗时",
        "在开放问题上提出新方法"
      ]
    },
    {
      "id": "A02",
      "name": "LLM critic 评估器",
      "role": "对 agent 产出的结果与新概念进行价值与新颖性判断，决定哪些探索路径继续、哪些被否决。",
      "incentives": [
        "筛掉低质量结果",
        "给出新颖性与可行性判断",
        "为搜索提供奖励信号"
      ]
    },
    {
      "id": "A03",
      "name": "LANDAU 分层学术数据宇宙",
      "role": "保存精确检索到的论文、人工整理的先验知识、以及被验证过的方法论轨迹，供 agent 复用。",
      "incentives": [
        "提供高质量文献与先验",
        "沉淀可复用的方法论轨迹",
        "降低重复探索成本"
      ]
    },
    {
      "id": "A04",
      "name": "人类物理学家",
      "role": "在加速级提供工程任务、在自动化级指定假设与方法、在自主发现级给出开放问题，并隐含地裁定什么算真正的发现。",
      "incentives": [
        "加快自身科研",
        "把繁琐环节外包给 agent",
        "保留对发现价值的最终判断权"
      ]
    },
    {
      "id": "A05",
      "name": "底层 LLM",
      "role": "为推理与评估提供基础能力，受知识截止时间与推理深度限制。",
      "incentives": [
        "在已有知识范围内最大化推理质量"
      ]
    }
  ],
  "goals": [
    {
      "id": "G01",
      "statement": "让 AI 从科研辅助工具跨越为能独立探索开放问题的自主 AI 物理学家。",
      "owner": "A01"
    },
    {
      "id": "G02",
      "statement": "把原本需资深博士 1-3 个月的工程环节压缩到 6 小时内（加速级）。",
      "owner": "A01"
    },
    {
      "id": "G03",
      "statement": "在给定假设/方法下自动跑完实验—验证假设回路，把端到端周期压到 1 天（自动化级）。",
      "owner": "A01"
    },
    {
      "id": "G04",
      "statement": "用 LLM critic 判断结果是否足够好、足够新，以此界定一次成功的自主发现。",
      "owner": "A02"
    }
  ],
  "stocks": [
    {
      "id": "S01",
      "name": "已验证方法论轨迹库",
      "description": "LANDAU 中沉淀的、被验证过可复用的探索路径与方法论，随成功探索而累积。"
    },
    {
      "id": "S02",
      "name": "被否决/走不通的路径",
      "description": "被 LLM critic 判为低价值或不可行而中止 of 探索分支，目前默认不被系统性保留。"
    },
    {
      "id": "S03",
      "name": "文献与先验知识池",
      "description": "精确检索到的论文与人工整理的先验，质量随子领域成熟度而波动。"
    }
  ],
  "flows": [
    {
      "id": "F01",
      "from": "A03",
      "to": "A01",
      "description": "LANDAU 把检索到的文献、先验与已验证轨迹供给主 agent 复用。",
      "relation_type": "inference",
      "evidence_source": "Auditable relation F01 derived from: LANDAU 把检索到的文献、先验与已验证轨迹供给主 agent 复用。",
      "mechanism": "LANDAU 把检索到的文献、先验与已验证轨迹供给主 agent 复用。",
      "if_wrong_impact": "If F01 is wrong, re-check leverage points that depend on this relation: LANDAU 把检索到的文献、先验与已验证轨迹供给主 agent 复用。"
    },
    {
      "id": "F02",
      "from": "A01",
      "to": "A02",
      "description": "主 agent 把候选结果与新概念送交 LLM critic 评估。",
      "relation_type": "inference",
      "evidence_source": "Auditable relation F02 derived from: 主 agent 把候选结果与新概念送交 LLM critic 评估。",
      "mechanism": "主 agent 把候选结果与新概念送交 LLM critic 评估。",
      "if_wrong_impact": "If F02 is wrong, re-check leverage points that depend on this relation: 主 agent 把候选结果与新概念送交 LLM critic 评估。"
    },
    {
      "id": "F03",
      "from": "A02",
      "to": "A01",
      "description": "critic 把价值/新颖性判断作为奖励信号回送，驱动 MCTS 继续或剪枝。",
      "relation_type": "inference",
      "evidence_source": "Auditable relation F03 derived from: critic 把价值/新颖性判断作为奖励信号回送，驱动 MCTS 继续或剪枝。",
      "mechanism": "critic 把价值/新颖性判断作为奖励信号回送，驱动 MCTS 继续或剪枝。",
      "if_wrong_impact": "If F03 is wrong, re-check leverage points that depend on this relation: critic 把价值/新颖性判断作为奖励信号回送，驱动 MCTS 继续或剪枝。"
    },
    {
      "id": "F04",
      "from": "A01",
      "to": "S01",
      "description": "成功的探索被验证后沉淀进方法论轨迹库。",
      "relation_type": "inference",
      "evidence_source": "Auditable relation F04 derived from: 成功的探索被验证后沉淀进方法论轨迹库。",
      "mechanism": "成功的探索被验证后沉淀进方法论轨迹库。",
      "if_wrong_impact": "If F04 is wrong, re-check leverage points that depend on this relation: 成功的探索被验证后沉淀进方法论轨迹库。"
    }
  ],
  "feedback_loops": [
    {
      "id": "B01",
      "type": "balancing",
      "description": "MCTS 评分回路：critic 评分越低越剪枝，越高越深入，使搜索收敛到 critic 认可的区域。",
      "nodes": [
        "A01",
        "A02",
        "F02",
        "F03"
      ],
      "relation_type": "inference",
      "evidence_source": "Auditable relation B01 derived from: MCTS 评分回路：critic 评分越低越剪枝，越高越深入，使搜索收敛到 critic 认可的区域。",
      "mechanism": "MCTS 评分回路：critic 评分越低越剪枝，越高越深入，使搜索收敛到 critic 认可的区域。",
      "if_wrong_impact": "If B01 is wrong, re-check leverage points that depend on this relation: MCTS 评分回路：critic 评分越低越剪枝，越高越深入，使搜索收敛到 critic 认可的区域。"
    },
    {
      "id": "B02",
      "type": "reinforcing",
      "description": "复用增强回路：被验证轨迹沉淀进 LANDAU 后被反复复用，强化 agent 在熟悉路径上的表现。",
      "nodes": [
        "A01",
        "S01",
        "F01",
        "F04"
      ],
      "relation_type": "inference",
      "evidence_source": "Auditable relation B02 derived from: 复用增强回路：被验证轨迹沉淀进 LANDAU 后被反复复用，强化 agent 在熟悉路径上的表现。",
      "mechanism": "复用增强回路：被验证轨迹沉淀进 LANDAU 后被反复复用，强化 agent 在熟悉路径上的表现。",
      "if_wrong_impact": "If B02 is wrong, re-check leverage points that depend on this relation: 复用增强回路：被验证轨迹沉淀进 LANDAU 后被反复复用，强化 agent 在熟悉路径上的表现。"
    },
    {
      "id": "B03",
      "type": "reinforcing",
      "description": "critic 偏见自我放大回路：critic 残留幻觉与偏见会持续否决某类探索，使其从未被采样、偏见无法被纠正。",
      "nodes": [
        "A02",
        "S02",
        "F03"
      ],
      "relation_type": "inference",
      "evidence_source": "Auditable relation B03 derived from: critic 偏见自我放大回路：critic 残留幻觉与偏见会持续否决某类探索，使其从未被采样、偏见无法被纠正。",
      "mechanism": "critic 偏见自我放大回路：critic 残留幻觉与偏见会持续否决某类探索，使其从未被采样、偏见无法被纠正。",
      "if_wrong_impact": "If B03 is wrong, re-check leverage points that depend on this relation: critic 偏见自我放大回路：critic 残留幻觉与偏见会持续否决某类探索，使其从未被采样、偏见无法被纠正。"
    }
  ],
  "rules": [
    {
      "id": "RL01",
      "statement": "由单一 LLM critic 判定结果好不好、新不新，作为价值与新颖性的裁决标准。",
      "explicitness": "explicit"
    },
    {
      "id": "RL02",
      "statement": "一次自主发现以 agent 端到端独立跑完一个被给定/被选定的问题来界定。",
      "explicitness": "explicit"
    },
    {
      "id": "RL03",
      "statement": "被 critic 否决的路径默认不进入可复用轨迹库，相当于被丢弃。",
      "explicitness": "inferred"
    },
    {
      "id": "RL04",
      "statement": "成熟度按耗时压缩比例分级（加速/自动化/自主发现），把时间当作主要进步度量。",
      "explicitness": "explicit"
    }
  ],
  "information_flows": [
    {
      "id": "I01",
      "sender": "A02",
      "receiver": "A01",
      "content": "对候选结果的好/新二元价值判断（含可能残留的幻觉与偏见）。",
      "timing": "每次候选结果产出后、搜索决定继续或剪枝前。",
      "relation_type": "inference",
      "evidence_source": "Auditable relation I01 derived from: 对候选结果的好/新二元价值判断（含可能残留的幻觉与偏见）。",
      "mechanism": "对候选结果的好/新二元价值判断（含可能残留的幻觉与偏见）。",
      "if_wrong_impact": "If I01 is wrong, re-check leverage points that depend on this relation: 对候选结果的好/新二元价值判断（含可能残留的幻觉与偏见）。"
    },
    {
      "id": "I02",
      "sender": "A03",
      "receiver": "A01",
      "content": "检索到的文献与先验知识，质量随子领域而异。",
      "timing": "任务开始与探索过程中按需检索。",
      "relation_type": "inference",
      "evidence_source": "Auditable relation I02 derived from: 检索到的文献与先验知识，质量随子领域而异。",
      "mechanism": "检索到的文献与先验知识，质量随子领域而异。",
      "if_wrong_impact": "If I02 is wrong, re-check leverage points that depend on this relation: 检索到的文献与先验知识，质量随子领域而异。"
    },
    {
      "id": "I03",
      "sender": "A04",
      "receiver": "A01",
      "content": "人工指定的假设、方法或开放问题。",
      "timing": "任务启动时，自动化级与自主发现级各不相同。",
      "relation_type": "inference",
      "evidence_source": "Auditable relation I03 derived from: 人工指定的假设、方法或开放问题。",
      "mechanism": "人工指定的假设、方法或开放问题。",
      "if_wrong_impact": "If I03 is wrong, re-check leverage points that depend on this relation: 人工指定的假设、方法或开放问题。"
    }
  ],
  "delays": [
    {
      "id": "T01",
      "description": "从一次探索完成到其真实科研价值被人类社区确认之间的滞后。",
      "effect": "critic 的即时判断与长期价值脱钩，可能把后来被证明重要的路径过早剪枝。"
    },
    {
      "id": "T02",
      "description": "底层 LLM 知识截止时间与当前研究前沿之间的滞后。",
      "effect": "在新兴/抽象领域 agent 缺乏最新先验，表现下降。"
    }
  ],
  "boundaries": [
    {
      "id": "BD01",
      "inside": "被给定/被选定的单个物理问题，以及该问题内的端到端求解与评估。",
      "outside": "问题该不该被提出、谁来定义值得做的问题、跨问题的研究品味与议程设定。"
    },
    {
      "id": "BD02",
      "inside": "由 LLM critic 代理的价值与新颖性判断。",
      "outside": "人类社区、实验验证、定理证明工具等多元判断主体。"
    },
    {
      "id": "BD03",
      "inside": "成功并被验证的探索轨迹（进入复用库）。",
      "outside": "失败与被否决的探索（不被保留为学习资产）。"
    }
  ],
  "failure_modes": [
    {
      "id": "FM01",
      "description": "LLM critic 残留幻觉，在评估新概念时引入偏见或漏掉本可行的探索路径。",
      "linked_nodes": [
        "A02",
        "I01",
        "B03"
      ]
    },
    {
      "id": "FM02",
      "description": "在新兴或小众子领域文献质量参差，拖垮检索依赖的整体表现。",
      "linked_nodes": [
        "A03",
        "S03",
        "I02"
      ]
    },
    {
      "id": "FM03",
      "description": "能力被底层 LLM 知识截止与推理深度所限，尤其在弦论、形式化量子场论等需纯符号推演的领域。",
      "linked_nodes": [
        "A05",
        "T02"
      ]
    },
    {
      "id": "FM04",
      "description": "被否决路径不被保留，系统失去从失败中学习与回溯的能力。",
      "linked_nodes": [
        "S02",
        "RL03",
        "BD03"
      ]
    }
  ],
  "uncertainties": [
    {
      "id": "U01",
      "question": "到底什么算一次真正的发现？端到端跑完一个被给定问题是否等同于发现？",
      "why_it_matters": "发现的定义决定了系统优化的目标与评估标准，是最深的可撬动假设。"
    },
    {
      "id": "U02",
      "question": "由谁、用什么来判断研究价值？单一 LLM critic 是否应当独占裁决权？",
      "why_it_matters": "价值裁决主体决定了哪些路径存活，直接影响系统能否产生真正新颖的方向。"
    },
    {
      "id": "U03",
      "question": "被否决/走不通的路径要不要留下来、如何复用？",
      "why_it_matters": "若失败资产被丢弃，系统无法形成负面知识库，重复踩坑且难以纠偏。"
    },
    {
      "id": "U04",
      "question": "人类物理学家在回路里到底扮演什么角色——出题人、裁判、合作者还是被取代者？",
      "why_it_matters": "人类角色的定位决定了系统是协作放大器还是替代叙事，影响评估方式与落地形态。"
    }
  ]
}
